[
  {
    "id": "business.advertising",
    "root": "business",
    "parent_id": null,
    "name": "Advertising",
    "type": "expense",
    "schedule_c_line": "8",
    "schedule_e_line": "5"
  },
  {
    "id": "business.business_income",
    "root": "business",
    "parent_id": null,
    "name": "Business Income",
    "type": "income",
    "schedule_c_line": "1",
    "schedule_e_line": "3"
  },
  {
    "id": "business.business_income.affiliate_income",
    "root": "business",
    "parent_id": "business.business_income",
    "name": "Affiliate Income",
    "type": "income",
    "schedule_c_line": "1",
    "schedule_e_line": "3"
  },
  {
    "id": "business.business_income.billable_expense_income",
    "root": "business",
    "parent_id": "business.business_income",
    "name": "Billable Expense Income",
    "type": "income",
    "schedule_c_line": "1",
    "schedule_e_line": "3"
  },
  {
    "id": "business.business_income.consulting_income",
    "root": "business",
    "parent_id": "business.business_income",
    "name": "Consulting Income",
    "type": "income",
    "schedule_c_line": "1",
    "schedule_e_line": "3"
  },
  {
    "id": "business.business_income.discounts_given",
    "root": "business",
    "parent_id": "business.business_income",
    "name": "Discounts Given",
    "type": "income",
    "schedule_c_line": "2",
    "schedule_e_line": "3"
  },
  {
    "id": "business.business_income.interest_income",
    "root": "business",
    "parent_id": "business.business_income",
    "name": "Interest Income",
    "type": "income",
    "schedule_c_line": "6",
    "schedule_e_line": null
  },
  {
    "id": "business.business_income.markup",
    "root": "business",
    "parent_id": "business.business_income",
    "name": "Markup",
    "type": "income",
    "schedule_c_line": "1",
    "schedule_e_line": "3"
  },
  {
    "id": "business.business_income.other_income",
    "root": "business",
    "parent_id": "business.business_income",
    "name": "Other Income",
    "type": "income",
    "schedule_c_line": "6",
    "schedule_e_line": "3"
  },
  {
    "id": "business.business_income.rents_received",
    "root": "business",
    "parent_id": "business.business_income",
    "name": "Rents Received",
    "type": "income",
    "schedule_c_line": "1",
    "schedule_e_line": "3"
  },
  {
    "id": "business.business_income.returns_allowances",
    "root": "business",
    "parent_id": "business.business_income",
    "name": "Returns & Allowances",
    "type": "income",
    "schedule_c_line": "2",
    "schedule_e_line": "3"
  },
  {
    "id": "business.business_income.royalties_received",
    "root": "business",
    "parent_id": "business.business_income",
    "name": "Royalties Received",
    "type": "income",
    "schedule_c_line": "6",
    "schedule_e_line": "4"
  },
  {
    "id": "business.business_income.sales",
    "root": "business",
    "parent_id": "business.business_income",
    "name": "Sales",
    "type": "income",
    "schedule_c_line": "1",
    "schedule_e_line": "3"
  },
  {
    "id": "business.business_income.sales_of_products",
    "root": "business",
    "parent_id": "business.business_income",
    "name": "Sales of Products",
    "type": "income",
    "schedule_c_line": "1",
    "schedule_e_line": "3"
  },
  {
    "id": "business.business_income.sales_of_purchased_goods",
    "root": "business",
    "parent_id": "business.business_income",
    "name": "Sales of Purchased Goods",
    "type": "income",
    "schedule_c_line": "1",
    "schedule_e_line": "3"
  },
  {
    "id": "business.business_income.tip_income",
    "root": "business",
    "parent_id": "business.business_income",
    "name": "Tip Income",
    "type": "income",
    "schedule_c_line": "1",
    "schedule_e_line": "3"
  },
  {
    "id": "business.car_truck",
    "root": "business",
    "parent_id": null,
    "name": "Car & Truck",
    "type": "expense",
    "schedule_c_line": "9",
    "schedule_e_line": "6"
  },
  {
    "id": "business.car_truck.car_insurance",
    "root": "business",
    "parent_id": "business.car_truck",
    "name": "Car Insurance",
    "type": "expense",
    "schedule_c_line": "9",
    "schedule_e_line": "6"
  },
  {
    "id": "business.car_truck.car_lease",
    "root": "business",
    "parent_id": "business.car_truck",
    "name": "Car Lease",
    "type": "expense",
    "schedule_c_line": "20a",
    "schedule_e_line": "19"
  },
  {
    "id": "business.car_truck.car_loan_interest",
    "root": "business",
    "parent_id": "business.car_truck",
    "name": "Car Loan Interest",
    "type": "expense",
    "schedule_c_line": "16b",
    "schedule_e_line": "13"
  },
  {
    "id": "business.car_truck.car_wash",
    "root": "business",
    "parent_id": "business.car_truck",
    "name": "Car Wash",
    "type": "expense",
    "schedule_c_line": "9",
    "schedule_e_line": "6"
  },
  {
    "id": "business.car_truck.gas_fuel",
    "root": "business",
    "parent_id": "business.car_truck",
    "name": "Gas & Fuel",
    "type": "expense",
    "schedule_c_line": "9",
    "schedule_e_line": "6"
  },
  {
    "id": "business.car_truck.parking_tolls",
    "root": "business",
    "parent_id": "business.car_truck",
    "name": "Parking & Tolls",
    "type": "expense",
    "schedule_c_line": "9",
    "schedule_e_line": "6"
  },
  {
    "id": "business.car_truck.registration",
    "root": "business",
    "parent_id": "business.car_truck",
    "name": "Registration",
    "type": "expense",
    "schedule_c_line": "9",
    "schedule_e_line": "6"
  },
  {
    "id": "business.car_truck.service_parts",
    "root": "business",
    "parent_id": "business.car_truck",
    "name": "Service & Parts",
    "type": "expense",
    "schedule_c_line": "9",
    "schedule_e_line": "6"
  },
  {
    "id": "business.commissions_fees",
    "root": "business",
    "parent_id": null,
    "name": "Commissions & Fees",
    "type": "expense",
    "schedule_c_line": "10",
    "schedule_e_line": "8"
  },
  {
    "id": "business.commissions_fees.bank_fees",
    "root": "business",
    "parent_id": "business.commissions_fees",
    "name": "Bank Fees",
    "type": "expense",
    "schedule_c_line": "10",
    "schedule_e_line": "19"
  },
  {
    "id": "business.commissions_fees.commissions",
    "root": "business",
    "parent_id": "business.commissions_fees",
    "name": "Commissions",
    "type": "expense",
    "schedule_c_line": "10",
    "schedule_e_line": "8"
  },
  {
    "id": "business.commissions_fees.processing_fees",
    "root": "business",
    "parent_id": "business.commissions_fees",
    "name": "Processing Fees",
    "type": "expense",
    "schedule_c_line": "10",
    "schedule_e_line": "8"
  },
  {
    "id": "business.commissions_fees.property_management",
    "root": "business",
    "parent_id": "business.commissions_fees",
    "name": "Property Management",
    "type": "expense",
    "schedule_c_line": "10",
    "schedule_e_line": "11"
  },
  {
    "id": "business.cost_of_goods_sold",
    "root": "business",
    "parent_id": null,
    "name": "Cost of Goods Sold",
    "type": "expense",
    "schedule_c_line": "42",
    "schedule_e_line": "19"
  },
  {
    "id": "business.cost_of_goods_sold.labor_cogs",
    "root": "business",
    "parent_id": "business.cost_of_goods_sold",
    "name": "Labor (COGS)",
    "type": "expense",
    "schedule_c_line": "37",
    "schedule_e_line": "19"
  },
  {
    "id": "business.cost_of_goods_sold.materials_supplies",
    "root": "business",
    "parent_id": "business.cost_of_goods_sold",
    "name": "Materials & Supplies",
    "type": "expense",
    "schedule_c_line": "38",
    "schedule_e_line": "15"
  },
  {
    "id": "business.cost_of_goods_sold.other_cogs",
    "root": "business",
    "parent_id": "business.cost_of_goods_sold",
    "name": "Other (COGS)",
    "type": "expense",
    "schedule_c_line": "39",
    "schedule_e_line": "19"
  },
  {
    "id": "business.cost_of_goods_sold.purchases_cogs",
    "root": "business",
    "parent_id": "business.cost_of_goods_sold",
    "name": "Purchases (COGS)",
    "type": "expense",
    "schedule_c_line": "36",
    "schedule_e_line": "19"
  },
  {
    "id": "business.debt_interest",
    "root": "business",
    "parent_id": null,
    "name": "Debt & Interest",
    "type": "expense",
    "schedule_c_line": null,
    "schedule_e_line": "13"
  },
  {
    "id": "business.debt_interest.credit_card_interest",
    "root": "business",
    "parent_id": "business.debt_interest",
    "name": "Credit Card Interest",
    "type": "expense",
    "schedule_c_line": "16b",
    "schedule_e_line": "13"
  },
  {
    "id": "business.debt_interest.loan_fees",
    "root": "business",
    "parent_id": "business.debt_interest",
    "name": "Loan Fees",
    "type": "expense",
    "schedule_c_line": null,
    "schedule_e_line": "13"
  },
  {
    "id": "business.debt_interest.loan_interest",
    "root": "business",
    "parent_id": "business.debt_interest",
    "name": "Loan Interest",
    "type": "expense",
    "schedule_c_line": "16b",
    "schedule_e_line": "13"
  },
  {
    "id": "business.debt_interest.mortgage_fees",
    "root": "business",
    "parent_id": "business.debt_interest",
    "name": "Mortgage Fees",
    "type": "expense",
    "schedule_c_line": null,
    "schedule_e_line": "12"
  },
  {
    "id": "business.debt_interest.mortgage_interest",
    "root": "business",
    "parent_id": "business.debt_interest",
    "name": "Mortgage Interest",
    "type": "expense",
    "schedule_c_line": "16a",
    "schedule_e_line": "12"
  },
  {
    "id": "business.depletion",
    "root": "business",
    "parent_id": null,
    "name": "Depletion",
    "type": "expense",
    "schedule_c_line": "12",
    "schedule_e_line": "18"
  },
  {
    "id": "business.depreciable_assets_form_4562",
    "root": "business",
    "parent_id": null,
    "name": "Depreciable Assets (Form 4562)",
    "type": "expense",
    "schedule_c_line": null,
    "schedule_e_line": null
  },
  {